{
  "complete": false,
  "components": [
    {
      "asset": {
        "bytes": 309408,
        "crate": "epaint_default_fonts@0.36.1",
        "location": "crate",
        "path": "fonts/Hack-Regular.ttf",
        "sha256": "15f55cc0c85a2988d2b4b3a8cdb5d77fdfbaf319e1bb5309d725db9818fb7125"
      },
      "containedBy": "registry+https://github.com/rust-lang/crates.io-index#epaint_default_fonts@0.36.1",
      "embeddedIn": [
        "ferritecad-viewer"
      ],
      "id": "asset+crate+epaint_default_fonts@0.36.1#fonts/Hack-Regular.ttf",
      "name": "Hack-Regular.ttf",
      "notAStagedRuntimeFile": "compiled into a product executable. There is no separate file to stage and none is staged.",
      "role": "embedded-asset",
      "stagedRuntimeFile": false,
      "targets": [
        "aarch64-apple-darwin",
        "x86_64-pc-windows-msvc",
        "x86_64-unknown-linux-gnu"
      ],
      "version": "0.36.1"
    },
    {
      "asset": {
        "bytes": 418804,
        "crate": "epaint_default_fonts@0.36.1",
        "location": "crate",
        "path": "fonts/NotoEmoji-Regular.ttf",
        "sha256": "415dc6290378574135b64c808dc640c1df7531973290c4970c51fdeb849cb0c5"
      },
      "containedBy": "registry+https://github.com/rust-lang/crates.io-index#epaint_default_fonts@0.36.1",
      "embeddedIn": [
        "ferritecad-viewer"
      ],
      "id": "asset+crate+epaint_default_fonts@0.36.1#fonts/NotoEmoji-Regular.ttf",
      "name": "NotoEmoji-Regular.ttf",
      "notAStagedRuntimeFile": "compiled into a product executable. There is no separate file to stage and none is staged.",
      "role": "embedded-asset",
      "stagedRuntimeFile": false,
      "targets": [
        "aarch64-apple-darwin",
        "x86_64-pc-windows-msvc",
        "x86_64-unknown-linux-gnu"
      ],
      "version": "0.36.1"
    },
    {
      "asset": {
        "bytes": 361676,
        "crate": "epaint_default_fonts@0.36.1",
        "location": "crate",
        "path": "fonts/Ubuntu-Light.ttf",
        "sha256": "80307b8da7649aa4ee4d484b232140e3ce1ec0ca093073d3c53c8f5a5ced7a70"
      },
      "containedBy": "registry+https://github.com/rust-lang/crates.io-index#epaint_default_fonts@0.36.1",
      "embeddedIn": [
        "ferritecad-viewer"
      ],
      "id": "asset+crate+epaint_default_fonts@0.36.1#fonts/Ubuntu-Light.ttf",
      "name": "Ubuntu-Light.ttf",
      "notAStagedRuntimeFile": "compiled into a product executable. There is no separate file to stage and none is staged.",
      "role": "embedded-asset",
      "stagedRuntimeFile": false,
      "targets": [
        "aarch64-apple-darwin",
        "x86_64-pc-windows-msvc",
        "x86_64-unknown-linux-gnu"
      ],
      "version": "0.36.1"
    },
    {
      "asset": {
        "bytes": 324132,
        "crate": "epaint_default_fonts@0.36.1",
        "location": "crate",
        "path": "fonts/emoji-icon-font.ttf",
        "sha256": "f426bec371f484646d002717e2c555a95cd5145e635d83a48bbef83f3abf18ca"
      },
      "containedBy": "registry+https://github.com/rust-lang/crates.io-index#epaint_default_fonts@0.36.1",
      "embeddedIn": [
        "ferritecad-viewer"
      ],
      "id": "asset+crate+epaint_default_fonts@0.36.1#fonts/emoji-icon-font.ttf",
      "name": "emoji-icon-font.ttf",
      "notAStagedRuntimeFile": "compiled into a product executable. There is no separate file to stage and none is staged.",
      "role": "embedded-asset",
      "stagedRuntimeFile": false,
      "targets": [
        "aarch64-apple-darwin",
        "x86_64-pc-windows-msvc",
        "x86_64-unknown-linux-gnu"
      ],
      "version": "0.36.1"
    },
    {
      "asset": {
        "bytes": 4083,
        "location": "repository",
        "path": "crates/ferritecad-viewport-gpu/src/grid.wgsl",
        "sha256": "b61a64e60e7d3abcffa650b7631fbb0e2ffaa3c59cb9f6a35f31a7760df5515b"
      },
      "containedBy": "path+crates/ferritecad-viewport-gpu#ferritecad-viewport-gpu@0.0.1",
      "embeddedIn": [
        "ferritecad-viewer"
      ],
      "id": "asset+path+crates/ferritecad-viewport-gpu/src/grid.wgsl",
      "name": "grid.wgsl",
      "notAStagedRuntimeFile": "compiled into a product executable. There is no separate file to stage and none is staged.",
      "role": "embedded-asset",
      "stagedRuntimeFile": false,
      "targets": [
        "aarch64-apple-darwin",
        "x86_64-pc-windows-msvc",
        "x86_64-unknown-linux-gnu"
      ],
      "version": "0.0.1"
    },
    {
      "asset": {
        "bytes": 19479,
        "location": "repository",
        "path": "crates/ferritecad-viewport-gpu/src/shader.wgsl",
        "sha256": "08b6c1de013f8a0946ab028529956854822033dfba6124e14fec9a86c689e243"
      },
      "containedBy": "path+crates/ferritecad-viewport-gpu#ferritecad-viewport-gpu@0.0.1",
      "embeddedIn": [
        "ferritecad-viewer"
      ],
      "id": "asset+path+crates/ferritecad-viewport-gpu/src/shader.wgsl",
      "name": "shader.wgsl",
      "notAStagedRuntimeFile": "compiled into a product executable. There is no separate file to stage and none is staged.",
      "role": "embedded-asset",
      "stagedRuntimeFile": false,
      "targets": [
        "aarch64-apple-darwin",
        "x86_64-pc-windows-msvc",
        "x86_64-unknown-linux-gnu"
      ],
      "version": "0.0.1"
    },
    {
      "asset": {
        "bytes": 4260,
        "location": "repository",
        "path": "crates/ferritecad-viewport-gpu/src/sketch.wgsl",
        "sha256": "985bba49ef0919c54a9634d62c908b3174063f2a03b12bda679b48a0a2d0bbf4"
      },
      "containedBy": "path+crates/ferritecad-viewport-gpu#ferritecad-viewport-gpu@0.0.1",
      "embeddedIn": [
        "ferritecad-viewer"
      ],
      "id": "asset+path+crates/ferritecad-viewport-gpu/src/sketch.wgsl",
      "name": "sketch.wgsl",
      "notAStagedRuntimeFile": "compiled into a product executable. There is no separate file to stage and none is staged.",
      "role": "embedded-asset",
      "stagedRuntimeFile": false,
      "targets": [
        "aarch64-apple-darwin",
        "x86_64-pc-windows-msvc",
        "x86_64-unknown-linux-gnu"
      ],
      "version": "0.0.1"
    },
    {
      "buildInputOf": [
        "native+planegcs@1.0.1"
      ],
      "id": "native+boost@1.91.0",
      "name": "Boost",
      "notAStagedRuntimeFile": "a header tree compiled into planegcs and into the sketch solver shim. No file of it is staged, on any target.",
      "role": "build-input",
      "source": {
        "kind": "source-archive",
        "pin": "tools/planegcs/pin.env",
        "sha256": "5734305f40a76c30f951c9abd409a45a2a19fb546efe4162119250bbe4d3a463",
        "url": "https://archives.boost.io/release/1.91.0/source/boost_1_91_0.tar.gz",
        "version": "1.91.0"
      },
      "stagedRuntimeFile": false,
      "targets": [
        "aarch64-apple-darwin",
        "x86_64-pc-windows-msvc",
        "x86_64-unknown-linux-gnu"
      ],
      "version": "1.91.0"
    },
    {
      "buildInputOf": [
        "native+planegcs@1.0.1"
      ],
      "id": "native+eigen@3.4.0",
      "name": "Eigen",
      "notAStagedRuntimeFile": "a header tree compiled into planegcs and into the sketch solver shim. No file of it is staged, on any target.",
      "role": "build-input",
      "source": {
        "kind": "source-archive",
        "pin": "tools/planegcs/pin.env",
        "sha256": "8586084f71f9bde545ee7fa6d00288b264a2b7ac3607b974e54d13e7162c1c72",
        "url": "https://gitlab.com/libeigen/eigen/-/archive/3.4.0/eigen-3.4.0.tar.gz",
        "version": "3.4.0"
      },
      "stagedRuntimeFile": false,
      "targets": [
        "aarch64-apple-darwin",
        "x86_64-pc-windows-msvc",
        "x86_64-unknown-linux-gnu"
      ],
      "version": "3.4.0"
    },
    {
      "fileModel": "one-component-with-file-inventory",
      "id": "native+occt@8.0.1",
      "loadedBy": [
        "ferritecad",
        "ferritecad-viewer"
      ],
      "name": "Open CASCADE Technology",
      "role": "runtime-native",
      "source": {
        "commit": "b8f597c677811d1f9f4d8a97f5ae2825c0353a42",
        "kind": "source-archive",
        "pin": "tools/occt/pin.env",
        "sha256": "dba62b81078dd43cec23feba89432be301582341001edad1b93342ad8bda35ea",
        "tag": "V8.0.1",
        "url": "https://github.com/Open-Cascade-SAS/OCCT/archive/b8f597c677811d1f9f4d8a97f5ae2825c0353a42.tar.gz"
      },
      "stagedFilenames": {
        "aarch64-apple-darwin": [
          "libTKBO.8.0.dylib",
          "libTKBRep.8.0.dylib",
          "libTKBin.8.0.dylib",
          "libTKBinL.8.0.dylib",
          "libTKBinTObj.8.0.dylib",
          "libTKBinXCAF.8.0.dylib",
          "libTKBool.8.0.dylib",
          "libTKCAF.8.0.dylib",
          "libTKCDF.8.0.dylib",
          "libTKDE.8.0.dylib",
          "libTKDECascade.8.0.dylib",
          "libTKDEIGES.8.0.dylib",
          "libTKDEOBJ.8.0.dylib",
          "libTKDEPLY.8.0.dylib",
          "libTKDESTEP.8.0.dylib",
          "libTKDESTL.8.0.dylib",
          "libTKDEVRML.8.0.dylib",
          "libTKExpress.8.0.dylib",
          "libTKFeat.8.0.dylib",
          "libTKFillet.8.0.dylib",
          "libTKG2d.8.0.dylib",
          "libTKG3d.8.0.dylib",
          "libTKGeomAlgo.8.0.dylib",
          "libTKGeomBase.8.0.dylib",
          "libTKHLR.8.0.dylib",
          "libTKHelix.8.0.dylib",
          "libTKLCAF.8.0.dylib",
          "libTKMath.8.0.dylib",
          "libTKMesh.8.0.dylib",
          "libTKMeshVS.8.0.dylib",
          "libTKOffset.8.0.dylib",
          "libTKOpenGl.8.0.dylib",
          "libTKPrim.8.0.dylib",
          "libTKRWMesh.8.0.dylib",
          "libTKService.8.0.dylib",
          "libTKShHealing.8.0.dylib",
          "libTKStd.8.0.dylib",
          "libTKStdL.8.0.dylib",
          "libTKTObj.8.0.dylib",
          "libTKTopAlgo.8.0.dylib",
          "libTKV3d.8.0.dylib",
          "libTKVCAF.8.0.dylib",
          "libTKXCAF.8.0.dylib",
          "libTKXMesh.8.0.dylib",
          "libTKXSBase.8.0.dylib",